{
  "meta": {
    "appVersion": "0.1.0",
    "schemaVersion": "2.0.0",
    "createdAt": "2026-04-18T00:00:00.000Z",
    "updatedAt": "2026-04-18T00:00:00.000Z",
    "forecastHorizonYears": 3,
    "currency": "AUD"
  },
  "setup": {
    "businessName": "Service Business",
    "startMonth": "jan",
    "tradingStructure": "sole_trader",
    "gstRegistration": "registered",
    "chargeGstOnSales": true,
    "basFrequency": "quarterly",
    "openingCash": 22000,
    "reportBasis": "dual_view"
  },
  "years": {
    "year1": {
      "assumptions": { "growthPct": 5, "cpiPct": 2, "taxRatePct": 25, "gstRatePct": 10 },
      "salesForecast": { "lineOverrides": [] },
      "marketing": {
        "lineItems": [
          { "id": "m1", "name": "Ads", "monthlyAmount": 900, "startMonth": 1, "endMonth": 12, "isOneOff": false }
        ]
      },
      "costProfile": {
        "fixedMonthlyCost": 4500,
        "variableCostPctOfRevenue": 8,
        "directLaborPctOfRevenue": 18,
        "otherOperatingExpenseMonthly": 1000
      },
      "ownerAdjustments": {
        "modelType": "sole_trader_drawings",
        "ownerDrawingsMonthly": 2400,
        "directorSalaryMonthly": 0,
        "distributionsMonthly": 0,
        "notes": ""
      }
    },
    "year2": {
      "assumptions": { "growthPct": 7, "cpiPct": 2, "taxRatePct": 25, "gstRatePct": 10 },
      "salesForecast": { "lineOverrides": [] },
      "marketing": { "lineItems": [] },
      "costProfile": {
        "fixedMonthlyCost": 4600,
        "variableCostPctOfRevenue": 8,
        "directLaborPctOfRevenue": 18,
        "otherOperatingExpenseMonthly": 1100
      },
      "ownerAdjustments": {
        "modelType": "sole_trader_drawings",
        "ownerDrawingsMonthly": 2500,
        "directorSalaryMonthly": 0,
        "distributionsMonthly": 0,
        "notes": ""
      }
    },
    "year3": {
      "assumptions": { "growthPct": 7, "cpiPct": 2, "taxRatePct": 25, "gstRatePct": 10 },
      "salesForecast": { "lineOverrides": [] },
      "marketing": { "lineItems": [] },
      "costProfile": {
        "fixedMonthlyCost": 4700,
        "variableCostPctOfRevenue": 8,
        "directLaborPctOfRevenue": 18,
        "otherOperatingExpenseMonthly": 1200
      },
      "ownerAdjustments": {
        "modelType": "sole_trader_drawings",
        "ownerDrawingsMonthly": 2600,
        "directorSalaryMonthly": 0,
        "distributionsMonthly": 0,
        "notes": ""
      }
    }
  },
  "salesDetails": {
    "lines": [
      {
        "id": "svc_1",
        "name": "Advisory Session",
        "type": "service",
        "unitPrice": 420,
        "defaultUnitsPerPeriod": 36,
        "seasonalityByMonth": [1, 0.9, 0.95, 1, 1.05, 1.1, 1.1, 1.1, 1.05, 1, 0.95, 0.9],
        "costOfGoodsSold": null,
        "grossMarginPercent": 68,
        "paymentMethod": "card",
        "merchantFeePercent": 1.9,
        "collectionProfile": "default",
        "gstApplies": true,
        "isActive": true
      }
    ]
  },
  "collectionsPolicy": {
    "defaultDebtorDays": 32,
    "badDebtPct": 0.5,
    "collectionSplitByMonthBucket": [0.75, 0.2, 0.05],
    "receivablesBasis": "gross",
    "openingReceivables": 2500
  },
  "assets": { "items": [] },
  "loans": { "items": [] },
  "personalCashFlow": { "year1Only": true, "items": [] },
  "derived": { "monthly": {}, "annual": {}, "quarterly": {}, "summaryCards": {}, "charts": {} },
  "warnings": []
}
